{
  "$schema": "./schema.json",
  "pack": "general-knowledge",
  "title": "General knowledge",
  "description": "Original family-friendly general knowledge questions.",
  "questions": [
    {"id": "gk-tn-capital", "category": "general", "difficulty": "easy", "type": "mcq", "answers": ["chennai", "madurai", "coimbatore", "tiruchirappalli"], "correct": 0, "i18n": {"en": {"prompt": "What is the capital of Tamil Nadu?", "answers": ["Chennai", "Madurai", "Coimbatore", "Tiruchirappalli"]}, "ta": {"prompt": "தமிழ்நாட்டின் தலைநகரம் எது?", "answers": ["சென்னை", "மதுரை", "கோயம்புத்தூர்", "திருச்சிராப்பள்ளி"]}, "hi": {"prompt": "तमिलनाडु की राजधानी क्या है?", "answers": ["चेन्नई", "मदुरै", "कोयंबटूर", "तिरुचिरापल्ली"]}}, "source": "original", "license": "CC-BY-4.0", "author": "Play With TV contributors", "status": "approved", "regions": ["tn"]},
    {"id": "gk-jupiter", "category": "general", "difficulty": "easy", "type": "mcq", "answers": ["saturn", "jupiter", "earth", "neptune"], "correct": 1, "i18n": {"en": {"prompt": "Which is the biggest planet in our solar system?", "answers": ["Saturn", "Jupiter", "Earth", "Neptune"]}, "ta": {"prompt": "நமது சூரியக் குடும்பத்தின் மிகப்பெரிய கோள் எது?", "answers": ["சனி", "வியாழன்", "பூமி", "நெப்டியூன்"]}, "hi": {"prompt": "हमारे सौरमंडल का सबसे बड़ा ग्रह कौन-सा है?", "answers": ["शनि", "बृहस्पति", "पृथ्वी", "नेपच्यून"]}}, "source": "original", "license": "CC-BY-4.0", "author": "Play With TV contributors", "status": "approved", "regions": ["global"]},
    {"id": "gk-national-animal", "category": "general", "difficulty": "easy", "type": "mcq", "answers": ["lion", "elephant", "bengal-tiger", "peacock"], "correct": 2, "i18n": {"en": {"prompt": "What is India's national animal?", "answers": ["Lion", "Elephant", "Bengal tiger", "Peacock"]}, "ta": {"prompt": "இந்தியாவின் தேசிய விலங்கு எது?", "answers": ["சிங்கம்", "யானை", "வங்கப் புலி", "மயில்"]}, "hi": {"prompt": "भारत का राष्ट्रीय पशु कौन-सा है?", "answers": ["शेर", "हाथी", "बंगाल टाइगर", "मोर"]}}, "source": "original", "license": "CC-BY-4.0", "author": "Play With TV contributors", "status": "approved", "regions": ["pan-india"]},
    {"id": "gk-leap-year", "category": "general", "difficulty": "easy", "type": "number", "answers": ["365", "364", "360", "366"], "correct": 3, "i18n": {"en": {"prompt": "How many days are there in a leap year?", "answers": ["365", "364", "360", "366"]}, "ta": {"prompt": "லீப் ஆண்டில் எத்தனை நாட்கள்?", "answers": ["365", "364", "360", "366"]}, "hi": {"prompt": "लीप वर्ष में कितने दिन होते हैं?", "answers": ["365", "364", "360", "366"]}}, "source": "original", "license": "CC-BY-4.0", "author": "Play With TV contributors", "status": "approved", "regions": ["global"]},
    {"id": "gk-plants-gas", "category": "general", "difficulty": "easy", "type": "mcq", "answers": ["carbon-dioxide", "oxygen", "nitrogen", "helium"], "correct": 0, "i18n": {"en": {"prompt": "Which gas do plants take from the air to make their food?", "answers": ["Carbon dioxide", "Oxygen", "Nitrogen", "Helium"]}, "ta": {"prompt": "தாவரங்கள் உணவு தயாரிக்கக் காற்றிலிருந்து எடுக்கும் வாயு எது?", "answers": ["கார்பன் டை ஆக்சைடு", "ஆக்சிஜன்", "நைட்ரஜன்", "ஹீலியம்"]}, "hi": {"prompt": "पौधे भोजन बनाने के लिए हवा से कौन-सी गैस लेते हैं?", "answers": ["कार्बन डाइऑक्साइड", "ऑक्सीजन", "नाइट्रोजन", "हीलियम"]}}, "source": "original", "license": "CC-BY-4.0", "author": "Play With TV contributors", "status": "approved", "regions": ["global"]},
    {"id": "gk-thirukkural", "category": "general", "difficulty": "easy", "type": "mcq", "answers": ["kambar", "thiruvalluvar", "avvaiyar", "bharathiyar"], "correct": 1, "i18n": {"en": {"prompt": "Who wrote the Thirukkural?", "answers": ["Kambar", "Thiruvalluvar", "Avvaiyar", "Bharathiyar"]}, "ta": {"prompt": "திருக்குறளை எழுதியவர் யார்?", "answers": ["கம்பர்", "திருவள்ளுவர்", "ஔவையார்", "பாரதியார்"]}, "hi": {"prompt": "तिरुक्कुरल किसने लिखा?", "answers": ["कंबर", "तिरुवल्लुवर", "अव्वैयार", "भारतियार"]}}, "source": "original", "license": "CC-BY-4.0", "author": "Play With TV contributors", "status": "approved", "regions": ["tn"]},
    {"id": "gk-longest-river", "category": "general", "difficulty": "medium", "type": "mcq", "answers": ["godavari", "kaveri", "ganga", "narmada"], "correct": 2, "i18n": {"en": {"prompt": "Which is the longest river flowing through India?", "answers": ["Godavari", "Kaveri", "Ganga", "Narmada"]}, "ta": {"prompt": "இந்தியாவில் ஓடும் மிக நீளமான ஆறு எது?", "answers": ["கோதாவரி", "காவிரி", "கங்கை", "நர்மதை"]}, "hi": {"prompt": "भारत में बहने वाली सबसे लंबी नदी कौन-सी है?", "answers": ["गोदावरी", "कावेरी", "गंगा", "नर्मदा"]}}, "source": "original", "license": "CC-BY-4.0", "author": "Play With TV contributors", "status": "approved", "regions": ["pan-india"]},
    {"id": "gk-smallest-prime", "category": "general", "difficulty": "medium", "type": "number", "answers": ["1", "3", "0", "2"], "correct": 3, "i18n": {"en": {"prompt": "What is the smallest prime number?", "answers": ["1", "3", "0", "2"]}, "ta": {"prompt": "மிகச் சிறிய பகா எண் எது?", "answers": ["1", "3", "0", "2"]}, "hi": {"prompt": "सबसे छोटी अभाज्य संख्या कौन-सी है?", "answers": ["1", "3", "0", "2"]}}, "source": "original", "license": "CC-BY-4.0", "author": "Play With TV contributors", "status": "approved", "regions": ["global"]},
    {"id": "gk-blue-yellow", "category": "general", "difficulty": "easy", "type": "mcq", "answers": ["green", "purple", "orange", "brown"], "correct": 0, "i18n": {"en": {"prompt": "Mix blue paint with yellow paint. What colour do you get?", "answers": ["Green", "Purple", "Orange", "Brown"]}, "ta": {"prompt": "நீல நிறத்தையும் மஞ்சள் நிறத்தையும் கலந்தால் என்ன நிறம் கிடைக்கும்?", "answers": ["பச்சை", "ஊதா", "ஆரஞ்சு", "பழுப்பு"]}, "hi": {"prompt": "नीला और पीला रंग मिलाने पर कौन-सा रंग बनता है?", "answers": ["हरा", "बैंगनी", "नारंगी", "भूरा"]}}, "source": "original", "license": "CC-BY-4.0", "author": "Play With TV contributors", "status": "approved", "regions": ["global"]},
    {"id": "gk-festival-lights", "category": "general", "difficulty": "easy", "type": "mcq", "answers": ["holi", "diwali", "pongal", "onam"], "correct": 1, "i18n": {"en": {"prompt": "Which festival is known as the festival of lights?", "answers": ["Holi", "Diwali", "Pongal", "Onam"]}, "ta": {"prompt": "ஒளியின் திருநாள் என்று அழைக்கப்படும் பண்டிகை எது?", "answers": ["ஹோலி", "தீபாவளி", "பொங்கல்", "ஓணம்"]}, "hi": {"prompt": "किस त्योहार को रोशनी का त्योहार कहा जाता है?", "answers": ["होली", "दिवाली", "पोंगल", "ओणम"]}}, "source": "original", "license": "CC-BY-4.0", "author": "Play With TV contributors", "status": "approved", "regions": ["pan-india"]},
    {"id": "gk-pongal", "category": "general", "difficulty": "easy", "type": "mcq", "answers": ["a-royal-wedding", "a-sea-voyage", "the-harvest", "a-cricket-victory"], "correct": 2, "i18n": {"en": {"prompt": "Pongal is a thanksgiving festival for what?", "answers": ["A royal wedding", "A sea voyage", "The harvest", "A cricket victory"]}, "ta": {"prompt": "பொங்கல் எதற்கான நன்றித் திருவிழா?", "answers": ["அரச திருமணம்", "கடல் பயணம்", "அறுவடை", "கிரிக்கெட் வெற்றி"]}, "hi": {"prompt": "पोंगल किस चीज़ के लिए धन्यवाद का त्योहार है?", "answers": ["शाही शादी", "समुद्री यात्रा", "फ़सल की कटाई", "क्रिकेट जीत"]}}, "source": "original", "license": "CC-BY-4.0", "author": "Play With TV contributors", "status": "approved", "regions": ["tn"]},
    {"id": "gk-red-planet", "category": "general", "difficulty": "easy", "type": "mcq", "answers": ["venus", "jupiter", "mercury", "mars"], "correct": 3, "i18n": {"en": {"prompt": "Which planet is called the Red Planet?", "answers": ["Venus", "Jupiter", "Mercury", "Mars"]}, "ta": {"prompt": "'சிவப்புக் கோள்' என்று அழைக்கப்படுவது எது?", "answers": ["வெள்ளி", "வியாழன்", "புதன்", "செவ்வாய்"]}, "hi": {"prompt": "किस ग्रह को लाल ग्रह कहा जाता है?", "answers": ["शुक्र", "बृहस्पति", "बुध", "मंगल"]}}, "source": "original", "license": "CC-BY-4.0", "author": "Play With TV contributors", "status": "approved", "regions": ["global"]},
    {"id": "gk-continents", "category": "general", "difficulty": "easy", "type": "number", "answers": ["7", "5", "6", "8"], "correct": 0, "i18n": {"en": {"prompt": "How many continents are there on Earth?", "answers": ["7", "5", "6", "8"]}, "ta": {"prompt": "பூமியில் எத்தனை கண்டங்கள் உள்ளன?", "answers": ["7", "5", "6", "8"]}, "hi": {"prompt": "पृथ्वी पर कितने महाद्वीप हैं?", "answers": ["7", "5", "6", "8"]}}, "source": "original", "license": "CC-BY-4.0", "author": "Play With TV contributors", "status": "approved", "regions": ["global"]},
    {"id": "gk-fastest-animal", "category": "general", "difficulty": "easy", "type": "mcq", "answers": ["lion", "cheetah", "horse", "leopard"], "correct": 1, "i18n": {"en": {"prompt": "Which is the fastest land animal?", "answers": ["Lion", "Cheetah", "Horse", "Leopard"]}, "ta": {"prompt": "நிலத்தில் மிக வேகமாக ஓடும் விலங்கு எது?", "answers": ["சிங்கம்", "சிவிங்கிப் புலி", "குதிரை", "சிறுத்தை"]}, "hi": {"prompt": "ज़मीन पर सबसे तेज़ दौड़ने वाला जानवर कौन-सा है?", "answers": ["शेर", "चीता", "घोड़ा", "तेंदुआ"]}}, "source": "original", "license": "CC-BY-4.0", "author": "Play With TV contributors", "status": "approved", "regions": ["global"]},
    {"id": "gk-national-bird", "category": "general", "difficulty": "easy", "type": "mcq", "answers": ["parrot", "eagle", "peacock", "swan"], "correct": 2, "i18n": {"en": {"prompt": "What is India's national bird?", "answers": ["Parrot", "Eagle", "Peacock", "Swan"]}, "ta": {"prompt": "இந்தியாவின் தேசியப் பறவை எது?", "answers": ["கிளி", "கழுகு", "மயில்", "அன்னம்"]}, "hi": {"prompt": "भारत का राष्ट्रीय पक्षी कौन-सा है?", "answers": ["तोता", "बाज़", "मोर", "हंस"]}}, "source": "original", "license": "CC-BY-4.0", "author": "Play With TV contributors", "status": "approved", "regions": ["pan-india"]},